{
  "job_id": "sample-project",
  "status": "passed_with_warnings",
  "checked_at": "2026-07-02T08:03:04.686451+00:00",
  "summary": "Validated 8 slides.",
  "manual_review_items": [
    "External visual generation was not configured."
  ],
  "slide_results": [
    {
      "slide_index": 0,
      "status": "passed",
      "checks": {
        "content_present": true,
        "text_preserved": true,
        "text_editable": true,
        "text_fit": true,
        "image_fit": true,
        "fallback_resolved": false
      },
      "issues": [],
      "recommended_action": "No action required.",
      "design_score": 80,
      "design_suggestions": []
    },
    {
      "slide_index": 1,
      "status": "passed",
      "checks": {
        "content_present": true,
        "text_preserved": true,
        "text_editable": true,
        "text_fit": true,
        "image_fit": true,
        "fallback_resolved": false
      },
      "issues": [],
      "recommended_action": "No action required.",
      "design_score": 80,
      "design_suggestions": []
    },
    {
      "slide_index": 2,
      "status": "passed",
      "checks": {
        "content_present": true,
        "text_preserved": true,
        "text_editable": true,
        "text_fit": true,
        "image_fit": true,
        "fallback_resolved": false
      },
      "issues": [],
      "recommended_action": "No action required.",
      "design_score": 80,
      "design_suggestions": []
    },
    {
      "slide_index": 3,
      "status": "passed",
      "checks": {
        "content_present": true,
        "text_preserved": true,
        "text_editable": true,
        "text_fit": true,
        "image_fit": true,
        "fallback_resolved": false
      },
      "issues": [],
      "recommended_action": "No action required.",
      "design_score": 80,
      "design_suggestions": []
    },
    {
      "slide_index": 4,
      "status": "passed",
      "checks": {
        "content_present": true,
        "text_preserved": true,
        "text_editable": true,
        "text_fit": true,
        "image_fit": true,
        "fallback_resolved": false
      },
      "issues": [],
      "recommended_action": "No action required.",
      "design_score": 80,
      "design_suggestions": []
    },
    {
      "slide_index": 5,
      "status": "passed",
      "checks": {
        "content_present": true,
        "text_preserved": true,
        "text_editable": true,
        "text_fit": true,
        "image_fit": true,
        "fallback_resolved": false
      },
      "issues": [],
      "recommended_action": "No action required.",
      "design_score": 80,
      "design_suggestions": []
    },
    {
      "slide_index": 6,
      "status": "passed",
      "checks": {
        "content_present": true,
        "text_preserved": true,
        "text_editable": true,
        "text_fit": true,
        "image_fit": true,
        "fallback_resolved": false
      },
      "issues": [],
      "recommended_action": "No action required.",
      "design_score": 80,
      "design_suggestions": []
    },
    {
      "slide_index": 7,
      "status": "passed",
      "checks": {
        "content_present": true,
        "text_preserved": true,
        "text_editable": true,
        "text_fit": true,
        "image_fit": true,
        "fallback_resolved": false
      },
      "issues": [],
      "recommended_action": "No action required.",
      "design_score": 80,
      "design_suggestions": []
    }
  ]
}
